{
  "cards": [
    {
      "id": "card-001",
      "name": "Demo Market",
      "code": "4006381333931",
      "format": "EAN13",
      "color": "#42A5F5",
      "customLogoUri": "data:image/png;base64,iVBORw0KGgoAAAANSUhEUgAAAAEAAAABCAQAAAC1HAwCAAAAC0lEQVR42mP8/x8AAwMCAO+ip1sAAAAASUVORK5CYII=",
      "sortIndex": 0,
      "createdAt": "2026-06-17T09:30:00.000Z",
      "updatedAt": "2026-06-17T09:30:00.000Z"
    }
  ],
  "settings": {
    "themeMode": "system",
    "sortMode": "manual"
  },
  "exportedAt": "2026-06-17T09:30:00.000Z",
  "version": "2.1.0"
}
